{
  "$schema": "test/harness/scenarios/schema.json",
  "version": 1,
  "id": "nested-monorepo-review",
  "name": "Review intent on nested monorepo",
  "workspaceFixture": "nested-monorepo",
  "prompt": "@roadie review the core package",
  "expect": {
    "intent": { "type": "review", "confidence": ">= 0.6" },
    "workflow": "review",
    "stepsExecuted": { ">=": 2, "<=": 12 }
  }
}
