{
  "$schema": "test/harness/scenarios/schema.json",
  "version": 1,
  "id": "confidence-adjusted",
  "name": "Learning-adjusted confidence changes classification",
  "workspaceFixture": "ts-calculator",
  "prompt": "@roadie fix failing calculator tests",
  "seed": {
    "workflowHistory": [
      { "type": "bug_fix", "status": "completed", "count": 4 },
      { "type": "bug_fix", "status": "cancelled", "count": 1 }
    ],
    "patternObservations": [
      { "patternId": "language:TypeScript", "count": 10 }
    ]
  },
  "expect": {
    "intent": { "type": "bug_fix", "confidence": ">= 0.7" },
    "workflow": "bug_fix",
    "stepsExecuted": { ">=": 4, "<=": 8 },
    "assertions": ["./assertions/confidence-adjusted.ts"]
  },
  "cassette": "confidence-adjusted.cassette.jsonl"
}
